name,brand,category,price,ingredients,url,type,store
Vitamin B Enzyme Cleansing Oil + Makeup Remover,One Love Organics,all-cleansers,42.0,"helianthus annuus seed oil, caprylic, di, polyglycerol, carica papaya seed oil, cucurbita pepo seed oil, tocopherol, ascorbyl palmitate, papain, lecithin, fragrance",https://credobeauty.com//collections/all-cleansers/products/one-love-organics-vitamin-b-enzyme-cleansing-oil-makeup-remover-new,clean,Credo
Exfoliating Instant Facial,Goop,all-cleansers,125.0,"aloe barbadensis leaf juice, vitis vinifera juice, citrus medica limonum juice, pyrus malus juice, glycerin, caprylic, lactic acid, microcrystalline cellulose, cetyl esters, stearyl alcohol, glyceryl stearate, helianthus annuus seed oil, hydroxypropyl starch phosphate, glycolic acid, capryloyl glycerin, diheptyl succinate, coco, essential oil blend, lavandula angustifolia oil, and citrus medica limonum oil, iris pallida leaf cell extract, narcissus poeticus flower extract, sodium hydroxide, vaccinium myrtillus fruit extract, malic acid, xanthan gum, gluconolactone, tartaric acid, saccharum officinarum extract, titanium dioxide, hydroxypropylcellulose, sodium benzoate, hydrolyzed hyaluronic acid, salicylic acid, citrus aurantium dulcis fruit extract, citrus limon fruit extract, tetrasodium glutamate diacetate, acer saccharum extract, panthenyl triacetate",https://credobeauty.com//collections/all-cleansers/products/exfoliating-instant-facial,clean,Credo
Hydrating Accelerator,Josh Rosebrook,all-cleansers,35.0,"aloe vera leaf juice, jojoba oil, marula seed oil, evening primrose oil, hemp seed oil, borage seed oil, almond oil, grape seed oil, sesame seed oil, sea buckthorn oil, goji berry, ashwaganda, calendula, black cohosh, dandelion, fo ti root, alfalfa, bilberry, rosemary, turmeric, elderberry, raspberry leaf, burdock, chamo, rose hips, eyebright, beetroot, st, hawthorne ber, chickweed, licorice, coriander, horse chestnut, lavender, red clover, olive leaf, sage, thyme, vitamin e, gum arabic, vanilla extract, ylang ylang essential oil, rosemary essential oil, eucalyptus essential oil, bergamot essential oil, carrot seed essential oil, organic, wildcrafted, non",https://credobeauty.com//collections/all-cleansers/products/josh-rosebrook-hydrating-accelerator,clean,Credo
Co Q10 Toner,Indie Lee,all-cleansers,34.0,"purified water, aloe barbadensis, coenzyme q10, hyaluronic acid, anthemis nobilis, salvia officinalis, carica papaya leaf extract, cucums sativus extract, citrus aurantium flower oil, 1, ethylhexylglycerin, potassium sorbate",https://credobeauty.com//collections/all-cleansers/products/indie-lee-co-q10-toner,clean,Credo
Brightening Cleanser,Indie Lee,all-cleansers,34.0,"purified water, decyl glucoside, disodium coco, coco glucoside oleaste, hydrolyzed wheat protein, xanthan gum, fragaria chiloensis seed oil, lycopene ,1, ethylhexylglycerin, potassium sorbate",https://credobeauty.com//collections/all-cleansers/products/indie-lee-brightening-cleanser,clean,Credo
Pure E.O. Free Oil Cleanser,Marie Veronique,all-cleansers,40.0,"Carthamus Tinctorius Seed Oil, Helianthus Annuus Seed Oil, Prunus Armeniaca Kernel Oil, Decyl Glucoside, Sucrose Cocoate, Mixed Tocopherols, Sambucus Nigra Extract, Xanthan Gum, Superoxide Dismutase, Probiotics, Galactooligosaccharides, Beta, Rosmarinus Officinalis Oleoresin",https://credobeauty.com//collections/all-cleansers/products/pure-e-o-free-oil-cleanser,clean,Credo
Essential Face Wipes,Ursa Major,all-cleansers,24.0,"Aloe barbadensis leaf juice, water, leuconostoc, rosmarinus officinalis leaf, salix nigra bark extract, hamamelis virginiana pulp water, glycerin, sodium hyaluronate, levulinic acid, sodium levulinate, vaccinium myrtillus fruit, saccharum officinarum extract, acer saccharum extract, citrus aurantium dulcis fruit extract, citrus limon fruit extract, oryza sativa seed extract, camellia sinensis leaf extract, betula alba sap, lactobacillus, caprylyl, fusel wheat bran, polyglyceryl, sodium cocoyl glutamate, glyceryl caprylate, olea europaea leaf extract, pseudotsuga menziesii needle oil, lavandula angustifolia flower oil, rosmarinus officinalis leaf oil, pelargonium graveolens leaf, boswellia carterii resin extract, leuconostoc ferment filtrate, propanediol, soybean peroxidase, superoxide dismutase, citric acid, potassium sorbate, alcohol, linalool, citronellol, geraniol, limonene",https://credobeauty.com//collections/all-cleansers/products/ursa-major-essential-face-wipes,clean,Credo
Easy Does It Foaming Cleanser,One Love Organics,all-cleansers,25.0,"aqua, glycerin, sodium coco, sodium hydroxypropylsulfonate laurylglucoside crosspolymer, sodium cocoyl hydrolyzed amaranth protein, sodium cocoamphoacetate, cocamidopropyl hydroxysultaine, lauryl glucoside, pyrus malus fruit extract, pyrus malus oil, quillaja saponaria bark extract, sodium methyl cocoyl taurate, sodium hydroxypropylsulfonate decylglucoside crosspolymer, sodium cocoyl glutamate, sodium lauryl glucose carboxylate, lonicera caprifolium flower extract, lonicera japonica flower extract",https://credobeauty.com//collections/all-cleansers/products/one-love-organics-easy-does-it-foaming-cleanser,clean,Credo
Balancing Hypo Tonic,Marie Veronique,all-cleansers,45.0,"Camellia Sinensis Leaf Infusion, Beta, Panthenol, Leuconostoc, Sambucus Nigra Extract, Glycyrrhiza Glabra Extract, Acetic Acid, Sodium Hyaluronate, Cucumis Sativus Fruit Extract, Pre, Curcuma Longa, Selenomethionine",https://credobeauty.com//collections/all-cleansers/products/balancing-hypo-tonic,clean,Credo
Fantastic Face Wash,Ursa Major,all-cleansers,28.0,"Aloe barbadensis leaf juice, aqua, lauryl glucoside, coco, sodium cocoyl glutamate, caprylyl, inulin, glyceryl laurate, sodium lauroamphoacetate, gluconolactone, sodium lauroyl glutamate, xylitylglucoside, anhydroxylitol, xylitol, oryza sativa extract, camellia sinensis leaf extract, saccharum officinarum extract, citrus limon fruit oil, citrus aurantium dulcis fruit extract, vaccinium myrtillus fruit extract, acer saccharum extract, picea mariana leaf oil, pseudotsuga menziesii branch, rosmarinus officinalis leaf water, lavandula angustifolia flower water, citrus paradisi peel oil, citrus aurantifolia peel oil, artemisia ludoviciana leaf oil, juniperus virginiana wood oil, tanacetum annuum flower oil, nardostachys jatamansi oil, vetiveria zizanoides root oil, mentha spicata leaf extract, sodium phytate, PCA glyceryl oleate, citric acid, calcium gluconate, leuconostoc ferment filtrate, sodium benzoate, soybean peroxidase, superoxide dismutase, limonene",https://credobeauty.com//collections/all-cleansers/products/ursa-major-fantastic-face-wash,clean,Credo
Ocean Cleanser,Osea,all-cleansers,48.0,"Aqua, Algae Extract, Decyl Glucoside, Sorbitan Olivate, Sesamum Indicum Seed Oil, Simmondsia Chinensis Seed Oil, Magnesium Aluminum Silicate, Tocopherol, Citrus Aurantifolia Oil, Citrus Aurantium Dulcis Oil, Juniperus Communis Fruit Oil, Cupressus Sempervirens Seed Oil, Jasminum Officinale Oil, Lactic Acid, Xanthan Gum, Glycine, Potassium Sorbate, Chlorophyll Extract ORGANIC INGREDIENT",https://credobeauty.com//collections/all-cleansers/products/osea-ocean-cleanser,clean,Credo
Regenerating Cleanser,Tata Harper,all-cleansers,84.0,"aloe barbadensis leaf juice, cetearyl alcohol, cetearyl olivate, helianthus annuus seed oil, prunus armeniaca seed powder, sorbitan olivate, oryza sativa extract, lactobacillus, leuconostoc ferment filtrate, aqua, coco, cetearyl glucoside, kaolin, sclerotium gum, cetyl palmitate, salix alba bark extract, sorbitan palmitate, sodium phytate, ci77491, benzyl alcohol, aroma, benzyl benzoate, citral, citronellol, eugenol, geraniol, limonene, linalool",https://credobeauty.com//collections/all-cleansers/products/tata-harper-regenerating-cleanser,clean,Credo
Resurfacing Mask,Tata Harper,all-cleansers,65.0,"aloe barbadensis leaf juice, salix alba bark extract, sclerotium gum, aqua, lactobacillus ferment, maltooligosyl glucoside, lactobacillus, leuconostoc ferment filtrate, beta vulgaris, kaolin, hydrogenated starch hydrolysate, hydrolyzed corn starch, aroma, ci77491, sodium phytate, benzyl alcohol, citral, citronellol, eugenol, geraniol, limonene, linalool",https://credobeauty.com//collections/all-cleansers/products/tata-harper-resurfacing-mask,clean,Credo
Camellia and Rose Gentle Hydrating Cleanser,Pai,all-cleansers,50.0,"camellia, b, c & e, camellia oleifera seed oil, ricinus communis seed oil, prunus amygdalus dulcis oil, cetearyl alcohol, glycerin, butyrospermum parkii butter, cetearyl glucoside, sodium anisate, tocopherol, rosa damascena oil, pelargonium graveolens oil, sodium levulinate, lavandula officinalis flower oil, lactic acid, litsea cubeba fruit oil, glyceryl stearate citrate, sodium lauroyl lactylate, d, geraniol, linalool certified organic by the soil association, artificial fragrances, detergents, formaldehyde, parabens, phenoxyethanol and propylene glycol",https://credobeauty.com//collections/all-cleansers/products/camellia-rose-gentle-hydrating-cleanser,clean,Credo
Doctor's Scrub Exfoliator,Goldfaden M.D.,all-cleansers,75.0,"water, ruby crystals, simmondsia chinensis seed oil, cetyl alcohol, candelilla, glyceryl stearate, glycerin, sodium hyaluronate, squalane, cetearyl alcohol, magnesium aluminum silicate, sodium stearoyl lactylate, glyceryl caprylate, xanthan gum, phenoxyethanol, cellulose gum, ethylhexylglycerin, chondrus crispus extract, citrus paradisi peel oil, aspalathus linearis leaf extract",https://credobeauty.com//collections/all-cleansers/products/goldfaden-md-doctors-scrub-exfoliator,clean,Credo
Brightening Facial Scrub,Acure,all-cleansers,10.0,"water, aloe barbadensis leaf juice, glycerin, sodium methyl cocoyl taurate, juglans regia shell powder, kaolin, sodium lauroamphoacetate, citrus limon peel, sodium pca, sodium lauroyl lactylate, glyceryl laurate, sodium cocoyl isethionate, olea europaea fruit oil, laminaria digitata powder, lilium candidum leaf leaf culture extract, euterpe oleracea fruit extract, rubus fruticosus fruit extract, rosa canina fruit extract, punica granatum extract, calendula officinalis flower extract, chamomilla recutita flower extract, asphalatus linearis leaf extract, chlorophyll, chrondus crispus extract, argania spinosa callus culture extract, chlorella vulgaris extract, helianthus annuus seed oil, cymbopogon flexuosus leaf oil, mentha virdis leaf oil, salvia sclarea oil, lavandula hybrida oil, cellulose gum, sodium levulinate, glucono, potassium sorbate",https://credobeauty.com//collections/all-cleansers/products/acure-organics-brilliantly-brightening-facial-scrub,clean,Credo
Daily Brightening Tonic,January Labs,all-cleansers,28.0,"water, aloe, lactic acid, lemon peel extract, orange fruit extract, apple fruit extract, witch hazel, organic sugar, black tea leaf extract, oat kernel extract, sodium pca, organic chamomile extract, glycerin, clary extract",https://credobeauty.com//collections/all-cleansers/products/january-labs-daily-brightening-tonic,clean,Credo
PlantGenius Creamy Bubbling Cleanser,Alpyn Beauty,all-cleansers,36.0,"water, glycerin, sodium cocoyl isethionate, sodium hyaluronate, hamamelis virginiana leaf extract, stearic acid, myristic acid, sodium methyl cocoyl taurate, cetearyl alcohol, lactobacillus, polyacrylate, sodium cocoyl apple amino acids, dehydroacetic acid, benzyl alcohol, tromethamine, carica papaya fruit extract, potassium sorbate, lavandula angustifolia oil, citrus aurantium dulcis oil, eclipta prostrata extract, melia azadirachta leaf extract, moringa pterygosperma seed oil, glycolic acid, lactic acid, ascorbic acid, linoleic acid, simmondsia chinensis seed oil, salvia officinalis leaf extract, arnica montana flower extract, borago officinalis flower extract, calendula officinalis flower extract, chamomilla recutita flower extract, ceramide ng, alcohol",https://credobeauty.com//collections/all-cleansers/products/plantgenius-creamy-bubbling-cleanser,clean,Credo
Luminous Melting Cleanser,Goop,all-cleansers,90.0,"prunus amygdalus dulcis oil, olea europaea fruit oil, cocos nucifera oil, polyglyceryl, helianthus annuus seed wax, butyrospermum parkii butter, essential oil blend, lavandula angustifolia oil and citrus medica limonum oil, iris pallida leaf cell extract, narcissus poeticus flower extract, cetearyl alcohol, glyceryl stearate, jojoba esters, tocopherol, theobroma cacao seed butter",https://credobeauty.com//collections/all-cleansers/products/luminous-melting-cleanser,clean,Credo
Brightening Coconut Towelettes,Acure,all-cleansers,7.0,"water, glycerin, decyl glucoside, aloe barbadensis leaf juice, cocos nucifera water, cucumis sativus extract, argania spinosa kernal oil, glycine soja oil, polysorbate 20, fragrance, sodium benzoate, potassium sorbate",https://credobeauty.com//collections/all-cleansers/products/acure-organics-coconut-argan-oil-cleansing-towelettes,clean,Credo
Daily Exfoliating Cleanser,Marie Veronique,all-cleansers,35.0,"Camellia Sinensis Leaf Infusion, Phaseolus Angularis Bean Powder, Avena Sativa Kernel Flour, Leuconostoc, Jojoba Beads, Aloe Barbadensis Leaf Juice, Glycerin, Xanthan Gum, Salix Nigra Bark Extract, Lactic Acid Extract, Chondrus Crispus Powder, Laminaria Digitata Powder, Rosmarinus Officinalis Oleoresin, Althaea Officinalis Root Powder, Oryza Sativa Bran, Honey, Lavandula Angustifolia Oil, Potassium Polysorbate, Pelargonium Graveolens  essential oils",https://credobeauty.com//collections/all-cleansers/products/daily-exfoliating-cleanser,clean,Credo
Goe Oil,Jao,all-cleansers,50.0,"jojoba butter, sunflower oil, jojoba oil, monoi tiare, rice bran oil, avocado butter, grape seed butter, grape seed oil, cocoa butter, meadowfoam seed oil, rosehip oil, soy lecithin, pumpkin seed butter, mango butter, cupuacu butter, avocado oil, shea butter, hemp seed oil, kukuinut oil, chamomile oil, beeswax, calendula oil, bergamot fruit oil, clary sage oil, palmarosa oil, lavender oil, tocopherol, vitamin e acetate, rosemary oil extract",https://credobeauty.com//collections/all-cleansers/products/goe-oil,clean,Credo
Restorative Tonic Mist,January Labs,all-cleansers,24.0,"Water, Aloe Organic Aloe Vera Leaf Juice, Witch Hazel, Sodium PCA, Rosa Extract, Glycerin, Sodium Lactate, Pro, Lime Oil, Licorice Extract, Horse Chestnut Extract, Hydrolyzed Yeast Protein, Calendula, Gotu Kola, Butcher’s Broom Root Extract",https://credobeauty.com//collections/all-cleansers/products/restorative-tonic-mist,clean,Credo
Shower Sheets,Yuni,all-cleansers,15.0,Water Saccharomyces Ferment Filtrate Glycerin Pyrus Malus Fruit Extract Polyglyceryl,https://credobeauty.com//collections/all-cleansers/products/yuni-shower-sheets,clean,Credo
Jasmine Green Tea Balancing Toner,Herbivore Botanicals,all-cleansers,39.0,"jasminum officinale flower water, aloe barbadensis leaf water, zingiber officinale root extract, hamamelis virginiana flower water, salix alba bark extract, camellia sinensis leaf extract, camellia sinensis leaf extract, leuconostoc, jasminum grandiflorum floral extract, citrus aurantium bergamia fruit oil, melia azadirachta leaf extract, melia azadirachta flower extract",https://credobeauty.com//collections/all-cleansers/products/jasmine-green-tea-balancing-toner,clean,Credo
Replenishing Oil Cleanser,Marie Veronique,all-cleansers,40.0,"carthamus tinctorius  seed oil, helianthus annuus  seed oil, prunus armeniaca  kernel oil, decyl glucoside, sucrose cocoate, tocotrienols & tocopherol, lavandula angustifolia  oil, sambucus nigra  extract, xanthan gum, pelargonium graveolens  oil, superoxide dismutase, probiotics, galactooligosaccharides, beta, rosmarinus officinalis  oleoresin",https://credobeauty.com//collections/all-cleansers/products/replenishing-oil-cleanser,clean,Credo
Jao Refresher,Jao,all-cleansers,18.0,"active ingredient, essential oils, glycerine, glyceryl polyacrylate, dl, acrylates, aminomethyl propanol, ppg, aloe barbadensis^, matricaria recutita, calendula officinalis ^organic",https://credobeauty.com//collections/all-cleansers/products/goe-hand-refresher-1,clean,Credo
4-in-1 Essential Tonic,Ursa Major,all-cleansers,26.0,"Aloe barbadensis leaf juice, aqua, leuconostoc, salix nigra bark extract, rosmarinus officinalis leaf water, hamamelis virginiana leaf water, glycerin, sodium hyaluronate, levulinic acid, sodium levulinate, saccharum officinarum extract, citrus limon fruit oil, citrus aurantium dulcis fruit extract, vaccinium myrtillus fruit extract, acer saccharum extract, camellia sinensis leaf extract, oryza sativa extract, betula alba juice, lactobacillus, caprylyl, fusel wheat bran, polyglyceryl, sodium cocoyl glutamate, glyceryl caprylate, olea europaea leaf extract, pseudotsuga menziesii branch, lavandula angustifolia flower oil, rosmarinus officinalis leaf oil, pelargonium graveolens leaf oil, boswellia carterii resin extract, alcohol, propanediol, leuconostoc ferment filtrate, soybean peroxidase, superoxide dismutase, citric acid, potassium sorbate, linalool, citronellol, geraniol, limoneneorganic",https://credobeauty.com//collections/all-cleansers/products/ursa-major-4-in-1-essential-tonic,clean,Credo
Rosehip Cleanser,Indie Lee,all-cleansers,34.0,"water, glycerin, potassium cocoate, fragrance, chondrus crispus extract, rosa rubiginosa seed oil, coccinia indica fruit extract, corallina officinalis extract, melia azadirachta flower extract, melia azadirachta seed oil, propanediol, pentylene glycol, xanthan gum, phenethyl alcohol, betaine, citric acid, hexyl cinnamal",https://credobeauty.com//collections/all-cleansers/products/rosehip-cleanser,clean,Credo
Bamboo Charcoal Soap,Herbivore Botanicals,all-cleansers,12.0,"saponified oils of cocos nucifera oil, olea europaea fruit oil, elaeis guineensis oil, tocopherol, kaolinite, activated bamboo charcoal, melaleuca alternifolia leaf oil, citrus bergamia esssential oil",https://credobeauty.com//collections/all-cleansers/products/bamboo-charcoal-soap,clean,Credo
The Vitamin Cleanse Facial Cleansing Cloths,Kaia Naturals,all-cleansers,16.0,"Agua, Miel, Sorbitan Laurate, Helianthus Annuus, Hydrolyzed Jojoba Esters, Glycerin, Decyl Glucoslde, Polyglyceryl, Dllauryl Citrate, Xanthan Gum, Citric Acid, Dehydroacetic Acid, Benzyl Alcohol, Potassium Sorbate, Sodium Benzoate, Citrus Sinensis Peel Oll, Citrus Bergamla Fruit Oil, Citrus Grandis Peel Oil, Citrus Medica Limonum Peel Oil, Citrus Aurantifolia Oil, Citrus Nobilis Peel Oil, Mentha Splcata Leaf Oil, Lavandula Angustifolia Oll",https://credobeauty.com//collections/all-cleansers/products/juicy-bamboo-facial-cleansing-cloths,clean,Credo
Raw Coconut Cream,RMS Beauty,all-cleansers,18.0,cocos nucifera oil,https://credobeauty.com//collections/all-cleansers/products/raw-coconut-cream,clean,Credo
Invigorating Mint Body Wash,basd body care,all-cleansers,16.0,"organic aloe vera juice, sodium c14, carya ovata bark extract, cocamidopropyl betaine, hydroxyethylcellulose, ethylene glycol distearate, peppermint oil, organic green tea extract, vitamin e oil, caprylyl glycol, sodium citrate, panthenol, allantoin",https://credobeauty.com//collections/all-cleansers/products/invigorating-mint-body-wash,clean,Credo
Pink Clay Soap,Herbivore Botanicals,all-cleansers,12.0,"Saponified Oils of Cocos nucifera Oil, Olea europaea Fruit Oil, Elaeis guineensis Oil, Tocopherol, Kaolinite, Kaolin, Pelargonium roseum asperum Essential Oil, Citrus sinensis Essential Oil",https://credobeauty.com//collections/all-cleansers/products/pink-clay-soap,clean,Credo
Active Enzyme Exfoliator,Josh Rosebrook,all-cleansers,65.0,"honey, vegetable glycerin, water, soy lecithin, avocado, jojoba, sunflower, evening primrose, neem, echinacea, hawthorn berry, alfalfa, ashwagandha, goji berry, beetroot, bilberry, black cohosh, rosemary, fennel, dandelion, calendula flowers, fo ti root, turmeric, sage, stevia, chamomile, rose hips, licorice, chick, horse chestnut, eyebright, st, coriander, burdock, elderberry, yucca, thyme, lavender, olive leaf, rasp, red clover, papaya enzyme, walnut shells, xanthan gum, guar gum, gum arabic, lemon essential oil, cypress essential oil, fennel essential oil, bergamot essential oil, lime essential oil, organic",https://credobeauty.com//collections/all-cleansers/products/josh-rosebrook-active-enzyme-exfoliator,clean,Credo
Seriously Soothing Cleansing Cream,Acure,all-cleansers,10.0,"water, sodium cocoyl isethionate, glyceryl stearate se, decyl glucoside, hydroxypropyl starch phosphate, glyceryl oleate, cocos nucifera oil, glycerin, hydrolyzed jojoba esters, phenethyl alcohol, caprylyl glycol, sodium lauroyl lactylate, glyceryl caprylate, disodium coco, sclerotium gum, ethylhexylglycerin, jojoba esters, alcohol, glycerophosphoinositol lysine, anthemis nobilis flower oil, rubus fruticosus fruit extract, rosa canina fruit extract, punica granatum extract, euterpe oleracea fruit extract, chamomilla recutita flower extract, calendula officinalis flower extract, aspalathus linearis leaf extract, isomalt, lecithin, argania spinosa sprout cell extract, sodium benzoate",https://credobeauty.com//collections/all-cleansers/products/acure-organics-sensitive-facial-cleanser,clean,Credo
G.Tox Ultimate Dry Brush,Goop,all-cleansers,20.0,Natural sisal fibers from the Mexican agave plant,https://credobeauty.com//collections/all-cleansers/products/g-tox-ultimate-dry-brush,clean,Credo
The Ultimate Makeup Remover Wipes,RMS Beauty,all-cleansers,16.0,1 compostable 100% natural rayon wipe contains 2,https://credobeauty.com//collections/all-cleansers/products/rms-beauty-ultimate-makeup-remover-wipes,clean,Credo
Gentle Cleansing Melt,Evolve Organic Beauty,all-cleansers,28.0,"caprylic, glycerin, helianthus annuus seed oil, prunus amygdalus dulcis seed oil, sucrose laurate, adansonia digitata seed oil, citrus aurantium dulcis fruit water, vanilla planifolia fruit extract, rosa damascena flower oil, tocopherol",https://credobeauty.com//collections/all-cleansers/products/gentle-cleansing-melt,clean,Credo
Gentle Gel Cleanser,Marie Veronique,all-cleansers,35.0,"Camellia Sinensis Leaf Infusion, Lavandula Angustifolia Hydrosol, Leuconostoc, Populus Tremuloides Bark, Glycerin, Xanthan Gum, Camellia Oleifera Seed Oil, Sucrose Cocoate, Decyl Glucoside, Glycyrrhiza Glabra Root Extract, Cymbopogon Martini Oil, Probiotics, Sodium Salicylate, Pelargonium Graveolens Oil, Lavandula Angustifolia Oil, Beta, Galactooligosaccharides, Citric Acid, Vetiveria Zizanoides Root Oil essential oils",https://credobeauty.com//collections/all-cleansers/products/gentle-gel-cleanser,clean,Credo
Complete Moisture Cleanse,Josh Rosebrook,all-cleansers,55.0,"aloe vera gel, aqua, african black soap, honey, vegetable glycerin, avocado, jojoba, argan, evening primrose, boabab, hemp seed, borage, almond, sunflower, grape seed, sesame, sea buckthorn, broccoli oil, saponifed coconut oil, rose petal, eyebright, turmeric, rosemary, sage, goji berry, alfalfa, beetroot, dandelion, ashwa, marshmallow, raspberry leaf, chickweed, calendula, elder, rose hips, ginkgo, milk thistle, black cohosh, licorice, gin, bladderwrack, fenugreek, hawthorn berry, cats claw, lavender, st, cinnamon, xanthan gum, potassium sorbate, vinegar, vanilla extract, rosemary essential oil, ylang ylang essential oil, euca, bergamot essential oil, organic, wildcrafted, non",https://credobeauty.com//collections/all-cleansers/products/josh-rosebrook-complete-moisture-cleanse,clean,Credo
Probiotic Exfoliation Mask,Marie Veronique,all-cleansers,50.0,"Camellia Sinensis Leaf Infusion, Butyrospermum Parkii Nut Butter, Lactobacillus, Sodium Salicylate, Xanthan Gum, Potato Flour, Cocos Nucifera Flour, Lactic Acid Extract, Probiotics, Cyamopsis Tetragonoloba Gum, Citrus Aurantium Oil, Citrus Sinensis Peel Oil, Citrus Limon Oil, Pelargonium Graveolens Oil essential oils",https://credobeauty.com//collections/all-cleansers/products/probiotic-exfoliation-mask,clean,Credo
Seductive Sandalwood Body Wash,basd body care,all-cleansers,16.0,"organic aloe vera juice, sodium c14, cocamidopropyl betaine, hydroxyethylcellulose, bergamot sandalwood fragrance, ethylene glycol disterate, ethyhexylglycerin, phenylpropanol, organic green tea extract, vitamin e oil, caprylyl glycol, sodium citrate, panthenol, allantoin",https://credobeauty.com//collections/all-cleansers/products/seductive-sandalwood-body-wash,clean,Credo
Gentle Cleanser,Peet Rivko,all-cleansers,28.0,"water, glycerin, caprylic, lauryl glucoside, glyceryl stearate citrate, hydroxypropyl starch phosphate, coco, glyceryl oleate, xanthan gum, propanediol, panthenol, allantoin, camellia sinensis leaf extract, stearic acid, aloe barbadensis leaf extract, gluconolactone, sodium benzoate",https://credobeauty.com//collections/all-cleansers/products/gentle-cleanser,clean,Credo
Seriously Soothing Micellar Water Towelettes,Acure,all-cleansers,7.0,"water, decyl glucoside, glycerin, pyrus malus, fruit extract, aloe barbadensis leaf juice, matricaria recutita extract, rosa damascena flower extract, cucumis sativus extract, avena sativa kernal extract, cocos nucifera fruit extract, poloxamer 184, sodium benzoate, potassium sorbate, citric acid",https://credobeauty.com//collections/all-cleansers/products/seriously-soothing-micellar-water-towelettes,clean,Credo
