name,brand,category,price,ingredients,url,type,store
Organic Flowers Original Toner,Whamisa,all-cleansers,40.0,"aloe maculata leaf extract, cucumis sativus fruit extract, galactomyces ferment filtrate,chrysanthemum morifolium flower extract, camellia sinensis leaf extract, oryza sativa extract, alcohol, rhodiola rosea root extract, scutellaria baicalensis root extract, glycyrrhiza glabra root extract, paeonia suffruticosa root extract, brassica oleracea italica extract, lactobacillus, lactobacillus, lactobacillus, xanthan gum, aniba rosaeodora wood oil, citrus aurantium bergamia fruit oil, geranium maculatum oil, cymbopogon schoenanthus oil, fragrance, d, linalol",https://credobeauty.com//collections/all-cleansers/products/organic-flowers-original-toner,clean,Credo
Matcha Beauty Bar,SkinOwl,all-cleansers,24.0,"sodium chloride distilled aqua, saponified olea europaea oil, unrefined organic vitellaria paradoxa butter, unrefined organic theobroma cacao seed butter, gmo, mentha spicata essential oil, gmo, gmo",https://credobeauty.com//collections/all-cleansers/products/matcha-beauty-bar,clean,Credo
Herb-Infused Toner,Vered Organic Botanicals,all-cleansers,22.0,"aqua, alcohol, glycerin, herbal extracts of, rosa damascena flower, symphytum officinale root, stellaria media, sambucus nigra flower, urtica dioica leaf, salvia officinalis leaf, curcuma longa root, melissa officinalis leaf, lippia citriodora leaf, cymbopogon citratus, echinacea angustifolia root, salix alba bark, acorus calamus root, lavandula angustifolia flower, calendula officinalis flower equisetum arvense, veronica officinalis, azadirachta indica leaf, , linalool, limonene, eugenol, geraniol, citral  certified organic",https://credobeauty.com//collections/all-cleansers/products/herb-infused-toner,clean,Credo
Protect+ Cleansing Milk,Nuori,all-cleansers,45.0,"water, pentylene glycol, cetearyl alcohol, squalane, jojoba, vitamin b3, avocado, glyceryl stearate, shea, polyglyceryl, rosehip, vitamin e, shea, chamomile, triethyl citrate, vitamin e, xanthan gum, sclerotium gum, maltodextrin, sodium stearoyl glutamate, sweet orange, lemon, fragrance, citral, limonene, sodium chloride, sodium gluconate, citric acid",https://credobeauty.com//collections/all-cleansers/products/protect-cleansing-milk,clean,Credo
Invigorating Mint Body Scrub,basd body care,all-cleansers,20.0,"coffea arabica seed powder, prunus amygdalus sativa kernel oil, water, sea salt, sucrose, tocopherol, mentha piperita oil",https://credobeauty.com//collections/all-cleansers/products/invigorating-mint-body-scrub,clean,Credo
Fleur De Rose Cream Cleanser,African Botanics,all-cleansers,100.0,"aqua, vitis vinifera seed oil, cetearyl alcohol, cetearyl glucoside, mangifera indica seed butter, squalane, vegetable glycerin, croton lechleri resin extract, cetyl alcohol, simmondsia chinensis seed oil, sclerocarya birrea seed oil, salix alba bark extract, allantoin, aspalathus linearis tea extract, niacinamide, salicylic acid, lactic acid, rosa moschata seed oil, persea gratissima oil, calendula officinalis flower oil, arnica cordifolia oil, cyclopia genistoides leaf extract, cape aloe leaf extract, rosa centifolia flower extract, ethylhexylglycerin, phenoxyethanol, wild",https://credobeauty.com//collections/all-cleansers/products/fleur-de-rose-cream-cleanser,clean,Credo
Botanical A Cleanser,One Love Organics,all-cleansers,39.0,"aloe barbadensis leaf juice, water, disodium cocoyl glutamate, lauryl glucoside, glycerin, lactic acid, gaultheria procumbens extract, salicylic acid, moringa oleifera seed oil, caprylyl, quillaja saponaria wood extract, citrus aurantium dulcis oil, eclipta prostrata extract, melia azadirachta leaf extract, benzyl alcohol, sorbic acid Ingredients from Organic Farming, excluding water & salt",https://credobeauty.com//collections/all-cleansers/products/botanical-a-cleanser,clean,Credo
Orange Blossom Honey Gel Cleanser,Therapi Honey Skincare,all-cleansers,33.75,"Aqua, Mel, Lauryl Glucoside, Decyl Glucoside, Cocamidopropyl Betaine, Gluconolactone, Xanthan Gum, Hippophae Rhamnoides Oil, Aloe Barbadensis Leaf Juice Powder, Yucca Schidigera Extract, Citrus Aurantium Dulcis Peel Oil, Citrus Aurantium Bergamia Fruit Oil, Lavandula Angustifolia Flower Oil, Citrus Aurantium Amara Flower Oil, Sodium Benzoate, Calcium Gluconate, Aroma, Limonene+, Linalool+, Citral+ Organic + Naturally occurs in essential oils Free from wheat and dairy",https://credobeauty.com//collections/all-cleansers/products/orange-blossom-honey-gel-cleanser,clean,Credo
Gutta Move On - Cleanser From Within,27 Rosiers,all-cleansers,49.0,"vitamin a, vitamin c, vitamin e, thiamine, riboflavin, niacin, vitamin b6, folate from folic acid, vitamin b12, biotin, pantothenic acid, zinc, ashwagandha, calendula, chamomile, aloe vera, green tea leaf extract, chlorella, resveratrol extract, probiotics, spirulina",https://credobeauty.com//collections/all-cleansers/products/gutta-move-on-cleanser-from-within,clean,Credo
Polish- Detoxifying Body Scrub,Beneath Your Mask,all-cleansers,70.0,"maris sal, aloe barbadensis, avena sativa flour, persea americana oil, bentonite clay, vitis vinifera oil, prunus amygdalus var, simmondsia chinensis oil, cymbopogon flexuosus essential oil, lavandula angustifolia essential oil, mixed tocopherols from non, melaleuca alternifolia essential oil  certified organic   organic   wild harvested  non",https://credobeauty.com//collections/all-cleansers/products/polish-detoxifying-body-scrub,clean,Credo
Herbal Balancing Oil Cleanser,Vered Organic Botanicals,all-cleansers,68.0,"simmondsia chinensis oil, cannabis sativa seed oil, cucurbita pepo oil, prunus amylgdalus dulcis, calophyllum inophyllum seed oil, herbal extracts of, stellaria media, veronica officinalis leaf, prunella vulgaris herb, thymus citriodorus leaf, curcuma longa root, echinacea angustifolia root, acorus calamus root, salix alba bark, castile base of saponified oils, potassium olivate, postassium jojobate, aloe barbadensis leaf juice, rosmarinus officinalis leaf, glycerin, litsea cubeba fruit oil, lavandula angustofolia oil tocopherol oil, linalool, limonene, geraniol, citral, citronellol  certified organic",https://credobeauty.com//collections/all-cleansers/products/herbal-balancing-oil-cleanser,clean,Credo
The Cleanser,Kjaer Weis,all-cleansers,95.0,"octyldodecanol, glycerin, aqua, caprylic, prunus amygdalus dulcis seed oil, squalane, coconut alkanes, olea europaea fruit oil, sucrose laurate, chamomilla recutita flower extract, coco, copernicia cerifera wax, camellia sinensis leaf extract, calendula officinalis flower extract, oak root extract, helianthus annuus seed oil, sucrose palmitate, parfum, sucrose stearate, benzyl alcohol, gallic acid, dehydroacetic acid, glyceryl stearate",https://credobeauty.com//collections/all-cleansers/products/the-cleanser,clean,Credo
Lemon Myrtle Honey Gel Cleanser,Therapi Honey Skincare,all-cleansers,33.75,"Aqua, Mel, Lauryl Glucoside, Decyl Glucoside, Cocamidopropyl Betaine, Gluconolactone, Xanthan Gum, Hippophae Rhamnoides Oil, Aloe Barbadensis Leaf Juice Powder, Yucca Schidigera Extract, Backhousia Citriodora Peel Oil, Leptospermum Petersonii Oil, Citrus Grandis Peel Oil, Juniperus Communis Fruit Oil, Mentha Piperita Oil, Sodium Benzoate, Calcium Gluconate, Aroma, Limonene+, Linalool+, Citronellol+, Geraniol+ Organic + Naturally occurs in essential oils Free from wheat and dairy",https://credobeauty.com//collections/all-cleansers/products/lemon-myrtle-honey-gel-cleanser,clean,Credo
Hydra-Restore Cream Cleanser,Grown Alchemist,all-cleansers,49.0,"Aqua, Camellia Oleifera Seed Oil, Vitis Vinifera Seed Oil, Cetearyl Olivate, Sorbitan Olivate, Cetyl Alcohol, Olea Europaea Leaf Extract, Plantago Lanceolata Leaf Extract, Citrus Sinensis Peel Oil Expressed, Xanthan Gum, Lactic Acid, Cananga Odorata Flower Oil, Tocopherol, Aloe Barbadensis Leaf Extract, Achillea Millefolium Extract, Avena Sativa Kernel Extract, Zinc Oxide, Pogostemon Cablin Leaf Oil, Santalum Spicata Wood Oil, Myroxylon Pereirae Oil, Niacinamide, Algae Extract, Benzyl Alcohol, Sodium Phytate, Dehydroacetic Acid, Citrus Paradisi Peel Oil, Linalool, Limonene, Benzyl Salicylate, Farnesol, Benzyl Benzoate",https://credobeauty.com//collections/all-cleansers/products/hydra-restore-cream-cleanser,clean,Credo
Shanta Rich Facial Cleanser,Abhati Suisse,all-cleansers,42.0,"aqua, glycerin, lauryl glucoside, sodium coco, cetyl alcohol, carrageenan, panthenol, saccharide isomerate, coco, glyceryl oleate, sodium chloride, citric acid, benzoic acid, bisabolol, moringa oleifera leaf extract, phyllantus emblica  fruit extract, sodium citrate, azadirachta indica  leaf extract, leontopodium alpinum  extract, sodium benzoate preservative, lactic acid, curcuma longa  root extract, parfum, potassium sorbate, linalool, citronellol, geraniol, limonene",https://credobeauty.com//collections/all-cleansers/products/shanta-face-cleanser,clean,Credo
Supreme Polishing Treatment,Nuori,all-cleansers,89.0,"ENZYME COMPLEX, pentylene glycol, betaine, squalane, cetearyl alcohol, shea, jojoba, glycerin, glycerin stearate, glyceryl stearate citrate, oat, sweet almond, vitamin e, lactobacillus, triethyl citrate, vitamin e, lactobacillus, cetearyl olivate, beeswax, leuconostoc, xanthan gum, sclerotium gum, tribenin, sorbitan olivate, orange, lemon, fragrance, citral, limonene, sodium gluconate, citric acid, hydrogenated jojoba oil, aloe vera",https://credobeauty.com//collections/all-cleansers/products/supreme-polishing-treatment,clean,Credo
Oil Cleanse,Olio E Osso,all-cleansers,80.0,"prunus armeniaca kernel oil, prunus amygdalus dulcis oil, olea europaea fruit oil",https://credobeauty.com//collections/all-cleansers/products/oil-cleanse,clean,Credo
Polishing Facial Exfoliant,Grown Alchemist,all-cleansers,67.0,"Aqua, Camellia Oleifera Seed Oil, Polylactic Acid, Cetearyl Olivate, Sorbitan Olivate, Cetyl Alcohol, Glucomannan Extract, Aloe Barbadensis Leaf Extract, Citrus Sinensis Peel Oil Expressed, Xanthan Gum, Pogostemon Cablin Leaf Oil, Citrus Reticulata Peel Oil, Tocopherol, Sodium Phytate, Cananga Odorata Flower Oil, Santalum Spicata Wood Oil, Citrus Paradisi Peel Oil, Pelargonium Graveolens Flower Oil, Benzyl Alcohol, Dehydroacetic Acid, Oenothera Biennis Oil, Rosa Canina Fruit Oil, Myroxylon Pereirae Oil, Mentha Piperita Oil, Linalool, Limonene",https://credobeauty.com//collections/all-cleansers/products/polishing-facial-exfoliant,clean,Credo
Hawaiian Beauty Water,Honua Hawaiian Skincare,all-cleansers,42.0,"Aloe Barbadensis Leaf Juice, Rosa Damascena Distillate, Glycerin, Hamamelis Virginiana Water, Sucrose, Alcohol, Hibiscus Sabdariffa Flower Powder, Hibiscus Sabdariffa Flower Extract, Salix Alba Bark Extract, Carica Papaya, Maltodextrin, Potassium Sorbate, Sodium Benzoate",https://credobeauty.com//collections/all-cleansers/products/hawaiian-beauty-water,clean,Credo
Pa'akai Cleansing Cream,Honua Hawaiian Skincare,all-cleansers,42.0,"Aqua, Rose Damascena, Hamemelis Virginiana, Fucus Vesiculosis, Hibiscus Sabdariffa, Sodium Chloride, Rose Damascena, Lavandula Angustifolia, Matricaria Recutita, Calendula Officinalis, Symphytum officinale, Rosa Mosqueta, Carthamus Tinctorius, Sesamum Indivum, Sorbitan Olivate, Aloe Barbadensis, Glycerin, Lecithin, Lithospermum Erythrorhizon, Salvia Officinalis, Rosmarinus Officinalis, Sodium Levulinate, Sodium Anisate",https://credobeauty.com//collections/all-cleansers/products/paakai-cleansing-cream,clean,Credo
G.Tox Malachite + AHA Pore Refining Tonic,Goop,all-cleansers,75.0,"water, glycolic acid, rosmarinus officinalis flower, sodium hydroxide, phytic acid, niacinamide, pelargonium graveolens flower, citrus limon fruit water, propanediol, glycerin, sea water, heptapeptide, ectoin, malachite extract, hydrolyzed sodium hyaluronate, bellis perennis flower extract, helichrysum italicum extract, spondias mombin pulp extract, mangifera indica pulp extract, musa sapientum pulp extract, caffeine, xanthan gum, citric acid, sodium chloride, pentylene glycol, hydroxyectoin, phenethyl alcohol, trisodium ethylenediamine disuccinate, potassium sorbate, carnosine, lecithin, sodium benzoate",https://credobeauty.com//collections/all-cleansers/products/g-tox-malachite-aha-pore-refining-tonic,clean,Credo
G.Tox Malachite + Fruit Acid Pore Purifying Cleanser,Goop,all-cleansers,48.0,"Water, capryloyl, lauroyl, coco, cocamidopropyl hydroxysultaine, glycerin, sucrose cocoate, spondias mombin pulp extract, mangifera indica pulp extract, musa sapientum pulp extract, pelargonium graveolens flower oil, malachite extract, eucalyptus globulus leaf oil, rosmarinus officinalis leaf oil, citrus aurantium dulcis peel oil, mentha piperita oil, mentha viridis leaf oil, schinus terebinthifolia fruit extract, xanthan gum, propanediol, canarium luzonicum gum nonvolatiles, dimethyl heptenal, pentylene glycol, sodium dehydroacetate, phenethyl alcohol, trisodium ethylenediamine disuccinate, triethyl citrate, citric acid, limonene, citronellol",https://credobeauty.com//collections/all-cleansers/products/g-tox-malachite-fruit-acid-pore-purifying-cleanser,clean,Credo
Crystal Clear Facial Cleansing Gel,BYBI Beauty,all-cleansers,30.0,"rosmarinus officinalis flower, aqua, propanediol, decyl glucoside, glycerin, erythritol, coco, inulin, caprylyl, xanthan gum, salix alba bark extract, quartz powder, lonicera caprifolium extract, citric acid, lonicera japonica extract, fructose, bisabolol, rosmarinus officinalis leaf oil, cupressus sempervirens oil, phytic acid, sodium benzoate, lactic acid, potassium sorbate, limonene",https://credobeauty.com//collections/all-cleansers/products/crystal-clear,clean,Credo
Skin Food Original,Weleda,all-moisturizers,12.5,"water, helianthus annuus seed oil, lanolin, prunus amygdalus dulcis oil, beeswax, alcohol, polyglyceryl, glycerin, limonene, viola tricolor extract, hydrolyzed beeswax, sorbitan olivate, rosmarinus officinalis leaf extract, chamomilla recutita flower extract, calendula officinalis flower extract, arginine, zinc sulfate, fragrance, linalool, geraniol, citral, coumarin",https://credobeauty.com//collections/all-moisturizers/products/skin-food-original,clean,Credo
Skin Food Light,Weleda,all-moisturizers,12.5,"water, helianthus annuus seed oil, glycerin, alcohol, glyceryl stearate citrate, beeswax, theobroma cacao seed butter, cetearyl alcohol, butyrospermum parkii butter, limonene, rosmarinus officinalis leaf extract, chamomilla recutita flower extract, calendula officinalis flower extract, viola tricolor extract, lanolin, carrageenan, xanthan gum, lactic acid, glyceryl caprylate, fragrance, linalool, geraniol, citral",https://credobeauty.com//collections/all-moisturizers/products/skin-food-light,clean,Credo
Plum Beauty Oil,Le Prunier,all-moisturizers,72.0,100% pure plum oil,https://credobeauty.com//collections/all-moisturizers/products/plum-beauty-oil,clean,Credo
Vital Balm Cream,Josh Rosebrook,all-moisturizers,45.0,"aloe barbadensis leaf juice, mangifera indica seed butter, persea gratissima oil, simmondsia chinensis seed oil, butyrospermum parkii butter, cassia angustifolia seed extract, glycerin, acacia senegal gum, borago officinalis seed oil, oenothera biennis oil, mel, brassica oleracea italica seed oil, hippophae rhamnoides oil, tocopherol, withania somnifera leaf extract, curcuma longa leaf extract, rosa canina flower extract, lycium barbarum fruit extract, calendula officinalis extract, cimicifuga racemosa root extract, sambucus nigra extract, fucus vesiculosus extract, althaea officinalis root extract, zingiber officinale extract, trigonella foenum, stellaria media extract, glycyrrhiza glabra root extract, rubus idaeus fruit extract, taraxacum officinale extract, salvia officinalis extract, euphrasia officinalis extract, silybum marianum extract, rosa canina flower powder, hypericum perforatum extract, uncaria tomentosa extract, cinnamomum cassia extract, lavandula angustifolia extract, ginkgo biloba leaf extract, rosmarinus officinalis extract, xanthan gum, potassium sorbate, tanacetum vulgare flower oil, cananga odorata flower oil, lavandula angustifolia herb oil, vanilla planifolia bean extract, | benzyl benzoate, | benzyl salicylate, | farnesol, | limonene, | linalool, organic, non, |natural constituents of essential oils",https://credobeauty.com//collections/all-moisturizers/products/josh-rosebrook-vital-balm-cream,clean,Credo
Golden Hour Recovery Cream,Ursa Major,all-moisturizers,48.0,"aloe barbadensis leaf juice, helianthus annuus seed oil, glyceryl stearate citrate, cetearyl alcohol, leuconostoc, glycerin, Limnanthes alba seed oil, galactoarabinan, cetyl palmitate, undecylenic glycerides, octyldodecanol, Ribes nigrum seed oil, Helianthus annuus seed oil unsaponifiables, Cardiospermum halicacabum flower, tocopherol, Rosmarinus officinalis leaf extract, Hippophae rhamnoides fruit extract, Santalum spicatum wood oil, Rosa damascena flower oil, Citrus aurantium amara flower oil, Cymbopogon martinii leaf oil, Calendula officinalis flower extract, sodium phytate, sodium anisate, glyceryl caprylate, sclerotium gum, xanthan gum, alcohol, citric acid",https://credobeauty.com//collections/all-moisturizers/products/ursa-major-golden-hour-recovery-cream,clean,Credo
Hyaluronic Serum 200,Evolve Organic Beauty,all-moisturizers,46.0,"aqua, rosa damascena water, aloe barbadensis leaf juice powder, punica granatum fruit extract, glycerin, amorphophallus konjac root powder, sodium hyaluronate, sodium levulinate, sodium anisate, sodium dehydroacetate ingredients from organic farming",https://credobeauty.com//collections/all-moisturizers/products/hyaluronic-serum-200,clean,Credo
Replenishing Night Cream,Goop,all-moisturizers,140.0,"Aloe barbadensis leaf juice, citrus medica limonum juice, pyrus malus juice, vitis vinifera juice, caprylic, glycerin, stearyl alcohol,cetearyl alcohol, coconut alkanes, myrica cerifera fruit wax, glyceryl stearate, fusanus spicatus kernel oil, capryloyl glycerin, gluconolactone, essential oil blend, lavandula angustifolia oil, and citrus medica limonum oil], diheptyl succinate, butyrospermum parkii butter extract, cetearyl olivate, sorbitan olivate, iris pallida leaf cell extract, narcissus poeticus flower extract, squalane, olea europaea fruit oil, prunus amygdalus dulcis oil, macadamia integrifolia seed oil, persea gratissima oil, prunus armeniaca kernel oil, palmitoyl tripeptide, jojoba esters, cetearyl glucoside, xanthan gum, coco, linum usitatissimum seed extract, behenyl behenate, tribehenin, 3, ascorbic acid, tocopherol, helianthus annuus seed oil, glyceryl caprylate, p, leuconostoc, hyaluronic acid, limonene, linalool, citral",https://credobeauty.com//collections/all-moisturizers/products/replenishing-night-cream-1,clean,Credo
5-in-1 Tinted Moisturizing Face Sunscreen,Suntegrity,all-moisturizers,45.0,"active ingredient, capric caprylic triglycerides, water, sorbitan stearate, glyceryl stearate, polyglyceryl, hexyl laurate, simmondsia chinensis seed oil, cetyl dimethicone, magnesium sulfate, helianthus annuus seed oil, cucumis sativus fruit extract, astaxanthin, hyaluronic acid, chlorella emersonii extract, camellia sinensis extract, punica granatum seed oil, polyaminopropyl biguanide, ethylhexylglycerin, iron oxide",https://credobeauty.com//collections/all-moisturizers/products/5-in-1-natural-moisturizing-face-sunscreen-tinted,clean,Credo
Tinted Face Oil,Kosas,all-moisturizers,42.0,"coco, simmondsia chinensis seed oil, octyldodecanol, persia gratissima oil, silica, kaolin, mica, oryza sativa bran extract, rosmarinus officinalis leaf extract, helianthus annuus extract, tocopherol, limnanthes alba seed oil, camellia oleifera seed oil, rosa canina fruit oil, rubus idaeus seed oil [+, iron oxides ]",https://credobeauty.com//collections/all-moisturizers/products/tinted-face-oil,clean,Credo
BB Cream,Lily Lolo,all-moisturizers,22.0,"aqua, caprylic, glycerin, coco, cetearyl olivate, sorbitan olivate, simmondsia chinensis seed oil, triticum vulgare germ oil, prunus amygdalus dulcis oil, argania spinosa kernel oil, stearic acid, cetyl alcohol, glyceryl stearate, boron nitride, benzyl alcohol, parfum, sodium benzoate, potassium sorbate, tocopherol, aloe barbadensis leaf juice powder, leptospermum scoparium oil, punica granatum seed oil, dehydroacetic acid, helianthus annuus seed oil, sodium hyaluronate, limonene, linalool, benzyl benzoate, benzyl salicylate, ci 77891, ci 77491, ci 77492, ci 77499",https://credobeauty.com//collections/all-moisturizers/products/lily-lolo-bb-cream,clean,Credo
Sheer Vivid Tinted Moisturizer,Ilia,all-moisturizers,42.0,"active ingredients, titanium dioxide 2%, aloe barbadensis leaf extract, glycerin, caprylic capric triglyceride, sesamum indicum seed oil, glyceryl stearate, behenyl olivate, chondrus crispus extract, persea gratissima oil, camellia sinensis extract, stearic acid, dimethicone, hydrolyzed jojoba esters, methylcellulose, cocos nucifera oil, butyrospermun parkii, rosa canina fruit oil, rosmarinus officinalis leaf extract, jasminum officinale oil, xanthan gum, sodium hyaluronate, tocopherol, ethylhexylglycerin, phenethyl alcohol, titanium dioxide, iron oxide",https://credobeauty.com//collections/all-moisturizers/products/ilia-belle-mare-t2-light-1,clean,Credo
Rosehip BioRegenerate Oil,Pai,all-moisturizers,44.0,"rosehip fruit and seed oil blend, 6, 7 & 9 plus antioxidant carotenoids work together to restore the appearance of damaged skin, rosa canina fruit extract, mixed tocopherols, rosmarinus officinalis leaf extract certified organic by the soil association",https://credobeauty.com//collections/all-moisturizers/products/rosehip-bioregenerate-oil,clean,Credo
Nutrient Day Cream with SPF 30,Josh Rosebrook,all-moisturizers,85.0,"active ingredient, shea butter, evening primrose oil, hemp seed oil, jojoba oil, borage seed oil, almond oil, grape seed oil, sesame oil, avocado oil, olive oil, sea buckthorn oil, broccoli oil, calendula, bilberry, chamomile, burdock, rosemary, fennel, dan, rose hips, catnip, chickweed, neem, skullcap, ginkgo leaf, linden flower, hawthorn berry, green tea, flax, nettle, sage, marshmallow root, cayenne, ginseng, peppermint, st, alfalfa, vitamin e, candelilla wax, guar gum, gum arabic, xanthan gum, potassium sorbate, mica, benzoin resin, carrot seed oil, organic, wildcrafted, non",https://credobeauty.com//collections/all-moisturizers/products/josh-rosebrook-nutrient-day-cream-with-spf-30,clean,Credo
Algae + Moringa Universal Face Oil,MARA,all-moisturizers,72.0,"moringa oleifera seed oil, vitius vinifera oil, helianthus annuus seed oil, linum usitatissimum seed oil, vaccinium myrtillus seed oil, caprylic, alaria esculenta extract, plankton extract, adansonia digitata seed oil, citrullus lanatus seed oil, citrus aurantium bergamia fruit oil, citrus aurantium amara peel oil, tocopherol",https://credobeauty.com//collections/all-moisturizers/products/algae-moringa-universal-face-oil,clean,Credo
Protective Day Oil,Marie Veronique,all-moisturizers,65.0,"Simmondsia Chinensis Seed Oil, Borago Officinalis Seed OIl, Persea Gratissima Oil, Limnanthes Alba Seed Oil, Argania Spinosa Kernel Oil, Rosa Mosqueta Seed Oil, Actinidia Chinensis Seed Oil, Calophyllum Inophyllum Oil, Olea Europaea Oil, Salvia Hispanica Oil, Rubus Idaeus Seed Oil, Sesamum Indicum Seed Oil, Sambucus Nigra Extract, Mixed Tocopherols, Camellia Oleifera Seed Oil, Punica Granatum Seed Oil, Opuntia Ficus, Astaxanthin, Lavandula Angustifolia Oil, Pelargonium Graveolens Oil, Omega, Brassica Oleracea Italica Seed Oil, Solanum Lycopersicum Seed Oil, Citrus Aurantium Oil, Helichrysum Italicum Flower Oil, Rosmarinus Officinalis Oleoresin, Myrtus Communis Oil",https://credobeauty.com//collections/all-moisturizers/products/protective-day-oil,clean,Credo
PlantGenius Melt Moisturizer,Alpyn Beauty,all-moisturizers,60.0,"water, sodium hyaluronate, cetyl alcohol, coconut alkanes, glycerin, pyrus malus fruit extract, potassium cetyl phosphate, aloe barbadensis leaf juice, prunus armeniaca kernel oil, capryloyl glycerin, coco, diheptyl succinate, centella asiatica meristem cell culture, xanthan gum, sorbitan stearate, dehydroacetic acid, benzyl alcohol, squalane, tripeptide, olea europaea fruit oil, glycolic acid, mica, titanium dioxide, potassium sorbate, butyrospermum parkii butter, tocopherol, linoleic acid, lavandula angustifolia oil, citrus aurantium dulcis oil, coenochloris signiensis extract, maltodextrin, lecithin, bakuchiol, hydrolyzed sodium hyaluronate, eclipta prostrata extract, melia azadirachta leaf extract, moringa pterygosperma seed oil, ceramide ng, ascorbic acid, simmondsia chinensis seed oil, salvia officinalis leaf extract, arnica montana flower extract, borago officinalis flower extract, calendula officinalis flower extract, chamomilla recutita flower extract",https://credobeauty.com//collections/all-moisturizers/products/plantgenius-melt-moisturizer,clean,Credo
Fortifying Face Balm,Ursa Major,all-moisturizers,36.0,"Aloe barbadensis leaf juice, aqua, glycerin, helianthus annuus seed oil, caprylic, leuconostoc, hamamelis virginiana leaf water, salix nigra bark extract, aleurites moluccana seed oil, hydrolyzed myrtus communis leaf extract, opuntia ficus, daucus carota sativa seed oil, hydrogenated lecithin, betula alba juice, olea europaea leaf extract, lavandula angustifolia flower oil, citrus aurantifolia peel oil, melaleuca quinquenervia oil, boswellia carterii resin extract, bisabolol, mentha spicata leaf extract, chondrus crispus, glucose, rosmarinus officinalis leaf extract, propanediol, xanthan gum, sodium anisate, sclerotium gum, alcohol, citric acid, sodium benzoate, potassium sorbate, limonene, linalool, citral  Denotes organic ingredients",https://credobeauty.com//collections/all-moisturizers/products/ursa-major-fortifying-face-balm,clean,Credo
