name,brand,category,price,ingredients,url,type,store
Super Serum Skin Tint SPF 40,Ilia,all-moisturizers,46.0,"Rendevous, Tulum, Miho, Roque, Squalane, Polyglyceryl, Butyloctyl Salicylate, Propanediol, Shea Butter Ethyl Esters, Isoamyl Laurate, Isopropyl Isostearate, Polyglyceryl, Methylpropanediol, Niacinamide, Sodium Chloride, Lecithin, Caprylyl Glycol, Silica, Aloe Barbadensis Leaf Juice Powder, Bisabolol, Hydrolyzed Sodium Hyaluronate, Allantoin, Phenylpropanol, Sodium Myristoyl Glutamate, Sodium Hyaluronate, Tetrasodium Glutamate Diacetate, Aluminum Hydroxide, Polyhydroxystearic Acid, CI 77492, CI 77499, CI 77891 Balos, Formosa, Diaz, Shela, Paloma, Porto Ferro, Matira, Kokkini, Kamari, Dominica, Porto Covo, Pavones, Squalane, Shea Butter Ethyl Esters, Isoamyl Laurate, Polyglyceryl, Butyloctyl Salicylate, Propanediol, Polyglyceryl, Isopropyl Isostearate, Methylpropanediol, Niacinamide, Sodium Chloride, Lecithin, Caprylyl Glycol, Silica, Aloe Barbadensis Leaf Juice Powder, Bisabolol, Hydrolyzed Sodium Hyaluronate, Allantoin, Phenylpropanol, Sodium Myristoyl Glutamate, Sodium Hyaluronate, Tetrasodium Glutamate Diacetate, Aluminum Hydroxide, Polyhydroxystearic Acid, CI 77492, CI 77499, CI 77891",https://credobeauty.com//collections/all-moisturizers/products/super-serum-skin-tint-spf-40,clean,Credo
C-Caf Cream,BYBI Beauty,all-moisturizers,34.0,"Citrus Aurantium Amara Flower Water, Shea Butter Ethyl Esters, Squalane, Glycerin, Cucumis Sativus Oil, Propanediol, Polyglyceryl, Aqua, Glyceryl Stearate SE, Ascorbyl Glucoside, Arginine, Xanthan Gum, Benzyl Alcohol, Camellia Sinensis Leaf Extract, Lactobacillus Ferment Lysate, Punica Granatum Extract, Caprylic Acid, Xylitol, Sodium Stearoyl Glutamate, Tocopherol, Lactobacillus Ferment, Citronellol, Farnesol, Geraniol, Linalool, Phytic Acid, Caffeine, Terminalia Ferdinandiana Fruit Extract, Citric Acid",https://credobeauty.com//collections/all-moisturizers/products/c-caf-cream,clean,Credo
Advanced Hydration Mask,Josh Rosebrook,masks-1,65.0,"shea butter, mango seed butter, aloe vera leaf juice, indian senna seed extract, sunflower seed oil, avocado oil, jojoba seed oil, evening primrose oil, candelilla wax, ashwagandha, turmeric root, rose hips, goji berry, calendula, black cohosh, elderberry, bladderwrack, marshmallow root, ginger, fenugreek, chickweed, licorice, raspberry leaf, dandelion, sage, eyebright, milk thistle, rose petal flower, st, cat’s claw, cinnamon, lavender, ginkgo biloba, xanthan gum, potassium sorbate, blue tansy essential oil, blue chamomile essential oil, lavender essential oil, rose essential oil, frankincense gum oil, ORGANIC, WILDCRAFTED, NON",https://credobeauty.com//collections/masks-1/products/josh-rosebrook-advanced-hydration-mask,clean,Credo
The Refresh Mint,Maya Chia,masks-1,68.0,"aloe barbadensis leaf juice, pure water, sodium pca, xylitylglucoside, hydroxyethylcellulose, salvia hispanica seed extract, azelaic acid, lactic acid, lactobacillus, gaultheria procumbens leaf extract, bromelain, sodium hyaluronate, melia azadirachta leaf extract, melia azadirachta flower extract, corallina officinalis extract, coccinia indica fruit extract, solanum melongena fruit extract, aloe barbadensis flower extract, ocimum sanctum leaf extract, ocimum basilicum flower, curcuma longa root extract, citrus sinesnsis essential oil, mentha arvensis essential oil, foeniculum vulgare essential oil, caprylyl, anhydroxylitol, xylitol, sodium phytate, xanthan gum, salicylic acid, glycerin, sorbic acid, benzyl alcohol",https://credobeauty.com//collections/masks-1/products/the-refresh-mint,clean,Credo
Clarifying Mask,Tata Harper,masks-1,72.0,"mel, kaolin, salvia officinalis flower, lactobacillis, l lactic acid, salix alba bark extract, lavandula angustifolia flower, maranta arundinacea root extract, bentonite, aroma, glyceryl undecylenate, pyrus malus seed oil, aqua, glycerin, hydrated silica, oenothera biennis oil, santalum spicatum seed oil, lannea microcarpa fruit extract, tasmannia lanceolata fruit, chlorella pyrenoidosa, vaccinium myrtillus fruit, gaultheria procumbens leaf extract, saccharum officinarum extract, citrus aurantium dulcis fruit extract, citrus limon fruit extract, acer saccharum extract, olea europaea oil, borago officinalis oil, arnica montana extract, borago officinalis leaf extract, calendula officinalis flower extract, medicago sativa extract, spiraea ulmaria flower extract, sambucus nigra fruit extract, alpha, glyceryl caprylate, sodium citrate, sodium phytate, ci 77288, linalool, limonene, geraniol, citronellol, citral, eugenol, methyl eugenol Ingredients from Organic farming",https://credobeauty.com//collections/masks-1/products/tata-harper-clarifying-mask,clean,Credo
Blue Tansy Mask,Herbivore Botanicals,masks-1,48.0,"aloe barbadensis leaf juice, hydroxyethyl ethylcellulose, glycerin, glyceryl caprylate, salix nigra bark extract, tanacetum annuum flower oil, ananas sativus fruit extract, carica papaya fruit extract, carica papaya leaf extract, jasminum sambac flower oil, leucidal",https://credobeauty.com//collections/masks-1/products/blue-tansy-mask,clean,Credo
Arctic Breeze Rescue Mask,Snow Fox,masks-1,35.0,"water, leuconostoc, rosa damascene flower water, glycerin, sodium hyaluronate, xanthan gum, mentha piperita water, aloe barbadensis leaf juice powder, polyglyceryl, undaria pinnatifida extract, sodium anisate, citric acid, pelargonium graveolens flower oil,mentha piperita oil  certified organic agricultural origin certified organic origin",https://credobeauty.com//collections/masks-1/products/arctic-breeze-rescue-mask,clean,Credo
Herbal Youth Preservation Mask,Snow Fox,masks-1,45.0,"water, rosa damascene flower water, glycerin, avena sativa kernel extract, leuconostoc, centella asiatica extract, olea europaea leaf extract, chlorella vulgaris extract, aloe barbadensis leaf juice powder, propylene glycol, panax ginseng root extract, sodium hyaluronate, glycolipids, glucosyl hesperidin, polyglyceryl, pelargonium graveolens flower oil, citrus aurantium amara flower oil, cananga odorata leaf, citric acid, xanthan gum, sodium anisate",https://credobeauty.com//collections/masks-1/products/herbal-youth-collagen-boosting-mask,clean,Credo
Japanese Cherry Blossom & White Tea Smoothing Mask,Snow Fox,masks-1,35.0,"water, leuconostoc, glycerin, sea water, cucurbita pepo seed extract, anthemis nobilis water, camellia sinensis leaf extract, saccharide isomerate, prunus yedoensis leaf extract, aloe barbadensis leaf juice powder, sodium hyaluronate, hydrolyzed hyaluronic acid, butylene glycol, sodium anisate, polyglyceryl, citric acid, sodium citrate, xanthan gum certified organic origin",https://credobeauty.com//collections/masks-1/products/japanese-cherry-blossom-white-tea-smoothing-mask,clean,Credo
3-Treatment Eye Gels Pack,Honest Hazel,masks-1,12.0,"cactus collagen, arbutin, vitamin c, vitamin e, hyaluronic acid, natural glycerin, aloe vera, vitamin b3",https://credobeauty.com//collections/masks-1/products/honest-hazel-3-treatment-eye-gels-pack,clean,Credo
Calming Midnight Mask,Alpyn Beauty,masks-1,68.0,"water, glycerin, cetearyl alcohol, brassicyl isoleucinate esylate, prunus amygdalus dulcis oil, helianthus annuus seed oil, aloe barbadensis leaf juice, brassica alcohol, glyceryl stearate, bakuchiol, melatonin, taraxacum officinale extract, vaccinium membranaceum extract, prunus virginiana extract, chamomillia recutita flower extract, arnica montana extract, borago officinalis extract, salvia officinalis leaf extract, calendula officinalis flower extract, arctostaphylos uva, salix alba bark extract, lactic acid, colloidal oatmeal, squalane, caprylhydroxamic acid, citrus aurantium bergamia fruit oil, arginine, caprylyl glycol, oleyl lactate, lavandula angustifolia oil, sodium hyaluronate, butyrospermum parkii butter, mangifera indica seed butter, simmondsia chinensis seed oil, centella asiatica extract, hydrolyzed gardenia florida extract, maltodextrin, valeriana officinalis root extract, propanediol, chlorella vulgaris extract, tasmannia lanceolata fruit",https://credobeauty.com//collections/masks-1/products/calming-midnight-mask,clean,Credo
Spacemasks Self Heating Eye Mask,Spacemasks,masks-1,5.0,"essence of jasmine, iron powder, water, carbon and salt",https://credobeauty.com//collections/masks-1/products/spacemasks-self-heating-eye-mask,clean,Credo
Glow Mask,Susanne Kaufmann,masks-1,90.0,"aqua purificata, butyrospermum parkii, pentylene glycol nat, caprylic, pullulan, porphyridium cruentum extract, levan, decyl glucoside, olea europaea leaf extract, alcohol plant, zizyphus jujuba seed extract, octyldodecanol, ribes nigrum seed oil, helianthus annuus seed oil, cardiosperum halicacabumextract, tocopherol, rosmarinus officinalis leaf extract, green caffeine extract, rubus idaeus fruit extracts, zingibert officinalis extract, magnolia officinalis bark extract, carrageenan, capsicum annuum extracmethyl glucose sesquistearate, oleic, glycerin, hydroxyporpyl methylcellulose, potassium sorbat, sodium stearoyl glutamate, pullulan, papain, stearyl alcohol, glyceryl stearate, myristylmyristate, maltodextrin, sodium polyphos­phate, xanthan gum, tocopheryl acetate, sodium benzoat, citric acid, ascorbic acid, parfum",https://credobeauty.com//collections/masks-1/products/glow-mask,clean,Credo
Bawdy Butt Mask,Bawdy,masks-1,9.0,"Bite It, polyglyceryl, xanthin gum, phenoxyethanol, ethylhexylglycerin, matricaria recutita extract, sodium hyaluronate, acacia seyal gum extract, potassium sorbate, aloe barbadensis leaf juice, citric acidShake It, glycerin, xanthan gum, phenoxyethanol, ethylhexylglycerin, haslea ostreaia extract, fucus vesiculosus extract, avena sativa kernal extract, hydrolyzed soy protein, aloe barbadensis leaf juice, matricaria recutita extract acacia seyal gum extract, mica, titanium dioxide, iron oxides, citric acidSlap It, glycerin, xanthan gum, phenoxyethanol, ethylhexylglycerin, caffeine, citrus aurantium dulcis peel extract, jania rubens extract, aloe barbadensis leaf juice, vitis vinifera seed extract, lycium barbarum fruit extract, heptyl glucoside, vitis vinifera seed oil, citric acidSqueeze It, glycerin, xanthan gum, phenoxyethanol, ethylhexylglycerin, citrus medica limonum extractcucumis sativus extract, ascorbyl glucoside, citrus grandis seed extractsaccharum officinarum extract, dipotassium glycyrrhizate, olea europaea leaf extract, morinda citrifolia extract, citrus aurantium dulcis peel extract, sodium hydroxide",https://credobeauty.com//collections/masks-1/products/bawdy-butt-mask,clean,Credo
Ready Selfie Go - Fresh Face Instant Mask,27 Rosiers,masks-1,48.0,"water, kaolin, glycerin, bentonite, glyceryl stearate, helianthus annuus seed oil, stearic acid, propanediol, arthrospira platensis extract, withania somnifera root extract, aloe barbadensis leaf juice, calendula officinalis flower extract, chamomilla recutita flower extract, butyrospermum parkii butter, chlorophyllin, fructose, caprylyl glycol, pentylene glycol, citric acid, potassium sorbate, sodium benzoate, fragrance, chromium oxide greens",https://credobeauty.com//collections/masks-1/products/ready-selfie-go-fresh-face-instant-mask,clean,Credo
Bamboo Charcoal Purifying Mask,LILFOX,masks-1,33.0,"moroccan lava clay, theobroma cacao ,lavendula angustifolia, solum follonum clay ,activated bamboo charcoal powder, althaea officianalis powder ,centella asiastic powder, boswellia carterii resin powder, matricaria recutitia powder, calendula officianalispowder, urica doica powder, curcuma longapowder organic wildcrafted",https://credobeauty.com//collections/masks-1/products/bamboo-charcoal-purifying-mask,clean,Credo
Hydrating Floral Mask,Tata Harper,masks-1,95.0,"helianthus annuus seed oil, glycerin, caprylic, butyrospermum parkii butter, cocos nucifera oil, propanediol, olea europaea oil, ricinus communis seed oil, aqua, hordeum vulgare leaf juice, cocos nucifera fruit extract, sucrose laurate, linoleic acid, sambucus nigra fruit extract, tocopherol, lactobacillus ferment, leuconostoc ferment filtrate, salvia hispanica seed extract, sodium hyaluronate, hyaluronic acid, tremella funciformis sporocarp extract, anigozanthos flavidus extract, banksia serrata flower extract, grevillea speciosa flower extract, musa sapientum flower extract, saccharide isomerate, linolenic acid, squalane, beta vulgaris, camellia oleifera seed oil, lavandula angustifolia flower, rosa damascena flower water, arnica montana extract, borago officinalis leaf extract, calendula officinalis flower extract, medicago sativa extract, spiraea ulmaria extract, simmondsia chinensis seed oil, ascorbyl palmitate, cera alba, copernicia cerifera wax, sucrose palmitate, sucrose stearate, sodium citrate, phenethyl alcohol, citric acid, hydrolyzed corn starch, ci 77288, aroma Ingredients from Organic farming",https://credobeauty.com//collections/masks-1/products/hydrating-floral-mask,clean,Credo
Lip Serum,Henne,masks-1,45.0,"organic rosa canina seed oil, organic camellia oleifera seed oil, organic argania spinosa kernel oil, organic simmondsia chinensis seed oil, rubus chamaemorus seed oil, organic prunus armeniaca kernel oil, organic punica granatum seed oil, organic passiflora edulis seed oil, organic raspberry flavor, vaccinitum vitis, tocopherol, organic cera alba",https://credobeauty.com//collections/masks-1/products/lip-serum,clean,Credo
Cacao Vanilla Beauty Mask,Vered Organic Botanicals,masks-1,68.0,"prunus amygdalus dulcis oleosomes, simmondsia chinensis seed oil, calophyllum inophyllum seed oil, theobroma cacao fruit powder, rosa canina fruit extract, althaea officinalis root extract, melissa officinalis leaf powder, rosa damascena flower powder, equisetum arvense powder, calendula officinale flower, lavandula officinalis flower, cinnamomum cassia bark extract, stellaria media extract, hibiscus sabdariffa flower powder, mahonia aquifolium root extract, santalum spicatum seed oil, vanilla planifolia bean extract, kaolin powder, glycerin, tocopherol certified organic",https://credobeauty.com//collections/masks-1/products/cacao-vanilla-beauty-mask,clean,Credo
Cerulean Mask,Kypris,masks-1,210.0,"aqua, glycerin, hydrolyzed fucus vesiculosus protein, leuconostoc, undaria pinnatifida cell culture extract, oryza sativa extract, xylitylglucoside, betaine, anyhydroxylitol, ahnfeltia concinna extract, sodium pca, cucumis sativus fruit extract, shea butter ethyl esters, bisabolol, tremella fuciformis sporocarp extract, inonotus obliquus extract, xylitol, melia azadirachta flower extract, phospholipids, melia azadirachta leaf extract, corallina officinalis extract, plankton extract, coccinia indica fruit extract, caprooyl tetrapeptide, dextran, tasmannia lanceolata fruit extract, prunus cerasus flower extract, sodium hyaluronate, eryngium maritimum callus culture filtrate, superoxide dismutase, ocimum sanctum leaf extract, lavandula angustifolia flower oil, aloe barbadensis extract, curcuma longa root extract, ocimum basilicum flower, solanum melongena fruit extract, rosmarinus officinalis leaf extract, sodium levulinate, sodium anisate, pelargonium graveolens leaf oil, santalum spicata wood oil, tanacetum annuum flower oil, citric acid, citronellol",https://credobeauty.com//collections/masks-1/products/cerulean-mask,clean,Credo
Very Gentle Hydra-Mask,Trilogy,masks-1,40.0,"aqua, prunus amygdalus dulcis oil, glycerin, cetearyl alcohol, aristotelia chilensis seed oil, cetearyl olivate, sorbitan olivate, hippophae rhamnoides oil, benzyl alcohol, phragmites kharka extract, poria cocos extract, xanthan gum, dehydroacetic acid, citric acid, preserved with dehydroacetic acid benzyl alcohol",https://credobeauty.com//collections/masks-1/products/very-gentle-hydra-mask,clean,Credo
Radiant Glow Mask,Evolve Organic Beauty,masks-1,28.0,"helianthus annuus seed oil, glycerin, cocos nucifera shell powder, kaolin, theobroma cacao seed powder, prunus amygdalus seed oil, sucrose laurate, citrus aurantium dulcis flower water, vanilla planifolia fruit extract, tocopherol, sucrose stearate, sucrose palmitate",https://credobeauty.com//collections/masks-1/products/radiant-glow-mask,clean,Credo
Skin Balancing Mask,Goldfaden M.D.,masks-1,75.0,"water, glycerin, simmondsia chinensis seed oil, ethyl macadamiate, lysolecithin, sclerotium gum, xanthan gum, pullulan, malic acid, tocopherol, simmondsia chinensis seed oil, gluconolactone, sodium benzoate, calcium gluconate, squalane, glycerin, sodium hyaluronate, dehydroacetic acid, benzyl alcohol, carrageenan, glucose, citrus paradisi peel oil, cellulose gum, glyceryl caprylate, dextran, caprooyl tetrapeptide, sambucus nigra flower extract, equisetum arvense extract, calendula officinalis flower extract, salvia geranium maculatum extract, panax ginseng extract, honey extract, rh, sodium hydroxide",https://credobeauty.com//collections/masks-1/products/skin-balancing-mask,clean,Credo
Moisture Renew Mask,January Labs,masks-1,34.0,"water, squalane, avocado oil, hyaluronic acid, sunflower seed oil, aloe leaf juice, caprylic, lactic acid, linoleic acid, apricot seed, corn sugar, sulfonic acid, palm oil, saccharide isomerate, shea butter, vitamin e, sage leaf extract, chamomile extract, ethylhexylglycerin, coconut oil, citric acid, sodium citrate, green tea leaf extract, cucumber fruit extract",https://credobeauty.com//collections/masks-1/products/moisture-renew-mask,clean,Credo
Love + Charcoal Masque,One Love Organics,masks-1,49.0,"aloe barbadensis leaf juice, kaolin, glyceryl stearate se, helianthus annuus seed oil, water, caprylyl, xylitylglucoside, sodium cocoyl hydrolyzed amaranth protein, charcoal powder, theobroma grandiflorum butter, rhododendron ferrugineum extract, pelargonium graveolens flower oil, glycerin, tocopherol, lactic acid, silax nigra bark extract, sclerotium gum, anhydroxylitol, xylitol, potassium sorbate, dehydroacetic acid, benzyl alcohol ingredients from organic farming",https://credobeauty.com//collections/masks-1/products/love-charcoal-masque,clean,Credo
Organic Hydrogel Mask,Whamisa,masks-1,8.0,"fruits & tomato, lactobacillus, lactobacillus, lactobacillus, lactobacillus, lactobacillus, corylus avellana seed oil, scutellaria baicalensis root extract, paeonia suffruticosa root extract, glycyrrhiza glabra root extract, honey, xanthan gum, lavandula angustifolia oil, aniba rosaeodora wood oil, citrus nobilis peel oil, rosmarinus officinalis leaf oil, d, linalol sheet, aloe maculata leaf extract, ceratonia siliqua gum, lactobacillus, lactobacillus, lactobacillus, lactobacillus, xanthan gum, scutellaria baicalensis root extract, paeonia suffruticosa root extract, glycyrrhiza glabra root extract flowers & aloe vera, lactobacillus, lactobacillus, lactobacillus, lactobacillus, helichrysum arenarium flower extract, rhodiola rosea root extract, corylus avellana seed oil, , brassica oleracea italica extract, camellia japonica seed oil, xanthan gum, scutellaria baicalensis root extract, paeonia suffruticosa root extract, glycyrrhiza glabra root extract, aniba rosaeodora wood oil, citrus aurantium bergamia fruit oil, d, aloe maculata leaf extract, ceratonia siliqua gum, lactobacillus, lactobacillus, lactobacillus, xanthan gum, scutellaria baicalensis root extract, paeonia suffruticosa root extract, glycyrrhiza glabra root extract seeds & rice, lactobacillus, lactobacillus, lactobacillus, lactobacillus, lactobacillus, lactobacillus, corylus avellana seed oil, scutellaria baicalensis root extract, paeonia suffruticosa root extract, glycyrrhiza glabra root extract, xanthan gum, lavandula angustifolia oil, aniba rosaeodora wood oil, citrus nobilis peel oil, rosmarinus officinalis leaf oil, adenosine, linalol sheet, hordeum vulgare seed extract, aloe maculata leaf extract, ceratonia siliqua gum, lactobacillus, lactobacillus, lactobacillus, angularis seed ferment filtrate, lactobacillus, xanthan gum, scutellaria baicalensis root extract, paeonia suffruticosa root extract, glycyrrhiza glabra root extract",https://credobeauty.com//collections/masks-1/products/organic-hydrogel-mask,clean,Credo
Organic Real Kelp Sheet Mask,Whamisa,masks-1,15.0,"essence, laminaria japonica extract, lactobacillus, serenoa serrulata fruit extract, angelica polymorpha sinensis root extract, , trigonella foenum, natto gum, leonurus sibiricus flower, dioscorea opposita root extract, camellia japonica seed oil, centella asiatica extract, argania spinosa kernel oil, anemarrhena asphodeloides root extract, bambusa vulgaris leaf, chlorella ferment, avena sativa kernel extract, corylus avellana seed oil, angelica keiskei leaf, citrus junos fruit extract, royal jelly, paeonia suffruticosa root extract, xanthan gum, scutellaria baicalensis root extract, plantago asiatica extract, glycyrrhiza glabra root extract, adenosine, lavandula angustifolia oil, aniba rosaeodora wood oil, citrus aurantium bergamia fruit oil, cymbopogon schoenanthus oil, d, linalol sheet",https://credobeauty.com//collections/masks-1/products/organic-real-kelp-sheet-mask,clean,Credo
Supreme Moisture Mask,Nuori,masks-1,89.0,"grape, damask rose, squalane, pentylene glycol, shea, coco, cetyl alcohol, avocado butter, vitamin b3, betaine, glyceryl stearate citrate, glycerin, apricot, bisabolol, hydrolyzed hyaluronic acid, chamomile, hyaluronic acid, water, xanthan gum, maltodextrin, geraniol, citronellol, sodium gluconate, citric acid, fragrance",https://credobeauty.com//collections/masks-1/products/supreme-moisture-mask,clean,Credo
Bright and Easy 3-Minute Flash Mask,Ursa Major,masks-1,44.0,"Aloe barbadensis leaf juice, hamamelis virginiana pulp water, glycerin, lactobacillus, populus tremuloides bark extract, alcohol, sclerotium gum, pectin, water, sodium hyaluronate, medicago sativa extract, hibiscus sabdariffa flower extract, salix alba bark extract, copper pca, triethyl citrate, caprylic, elettaria cardamomum seed extract, citrus limon peel extract, citrus aurantium dulcis peel extract, cucumis melo fruit extract, santalum album wood extract, pyrus malus fruit extract, rosa damascena flower extract, citrus grandis fruit extract, prunus armeniaca fruit extract, cananga odorata flower extract, rubus idaeus fruit extract, vanilla planifolia fruit extract, cucumis sativus fruit extract, ananas sativus fruit extract, passiflora incarnata fruit extract, lavandula angustifolia flower oil, sodium levulinate, sodium anisateorganic",https://credobeauty.com//collections/masks-1/products/bright-and-easy-3-minute-flash-mask,clean,Credo
Coconut Charcoal Face Mask,Cocovit,masks-1,18.1,"activated coconut charcoal, curcuma longa root powder, cocos nucifera, bentonite clay, azadirachta indica powder, ashwagandha root powder, pelargonium graveolens essential oil, pogostemon cablin essential oil certified organic",https://credobeauty.com//collections/masks-1/products/coconut-charcoal-face-mask,clean,Credo
Beauty Whip,SkinOwl,masks-1,68.0,"organic aloe leaf juice, organic olive fruit oil, organic alcohol, organic jojoba seed oil, emulsifying wax, stearic acid, hyaluronic acid, msm, dmae bitartrate, rosehip seed oil, organic evening primrose oil, organic rooibos leaf extract, organic lavender extract, maqui berry concentrate powder, organic calendula flower extract, organic green tea leaf extract, organic white tea leaf extract, vitamin e, sunflower seed oil, xanthan gum",https://credobeauty.com//collections/masks-1/products/beauty-whip,clean,Credo
Susanne Kaufmann Moisturizing Mask,Susanne Kaufmann,masks-1,68.0,"aqua purificata, glycerin, pentylene glycol nat, caprylic, cetearyl ethylhexanoate, glyceryl stearate, prunus amygdalus dulcis oil, viola tricolor extract, octyldodecanol, euphorbia cerifera cera, saccharide isomerate, maltitol, cetearyl alcohol, tocopheryl acetate, dicaprylyl carbonate, polyglyceryl, brassica oleracea italica seed oil, sodium stearoyl glutamate, hydrogenated lecithin, echium plantagineum seed oil, triticum vulgare gluten, mel, sodium hyaluronate, cardiospermum halicacabum extract, tocopherol, helianthus annuus seed oil, ethylhexyl palmitate, methyl glucose ses, caprylyl glycol, cholesterol, benzoic acid, citric acid, sodium citrate, linalool, benzyl salicylate, parfum",https://credobeauty.com//collections/masks-1/products/susanne-kaufmann-moisturizing-mask,clean,Credo
Infinite Resurfacing Mask,African Botanics,masks-1,200.0,"aqua, butylene glycol, glycerin, malva sylvestris extract, lactic acid, mentha leaf extract, melissa officinalis leaf extract, achillea millefolium extract, speedwell extract, primula veris extract, resveratrol, arctostaphylos leaf extract, glycolic acid, saccharide isomerate, ananas sativus fruit extract, carica papaya extract, bulbine frutescens, xanthan gum, hyaluronic acid, fucus vesiculosis extract, myrothamus flabellifolius plant, sorghum bicolor stalk juice, panicum miliaceum seed extract, tannic acid, hydrolyzed rice protein, glycine soja protein, superoxide dismutase, niacinamide, sodium ascorbyl phosphate, aloe ferox leaf extract, acetamide mea, panthenol, hydrolyzed wheat protein, phytic acid, triticum vulgare germ oil, linoleic acid, sommondsia chinensis seed oil, butylene glycol, sorbitol, d, ascorbyl methylsilanol pectinate, urtica dioica extract, equisetum arvense extract, cucumis sativus fruit extract, hydrocotyl extract, chamomile martricaria extract, chlorella vulgaris extract, hydrolyzed algin, salix alba, sclerocarya birrea seed oil, magnesium sulphate, tetrasodium glutamate diacetate, citrillus lanatus seed oil, copper gluconate, arnica cordifolia extract, aspalathus linearis tea extract, vitis vinifera seed oil, ethanol, jasmine grandiflorum flower oil, rosa mosqueta seed oil, ethylhexylglycerin, phenoxyethanol, Wild, mineral oils, parabens, allergens, phthalates, synthetic fragrances, PEGs and SLSs",https://credobeauty.com//collections/masks-1/products/african-botanics-infinite-resurfacing-mask,clean,Credo
